{
  "schema_version": "1.0.0",
  "library_id": "cloudflow-crm-rs-2026-08",
  "library_version": 1,
  "frozen": true,
  "content_hash": "sha256:963c7c52f27d3553a0fdfa6dd4b4d62d811e062b2dc0a47e1c633bcdb4127b19",
  "generated_at": "2026-08-01T12:00:00Z",
  "generator": {
    "skill": "geo-prompt-library",
    "skill_version": "0.1.0-draft"
  },
  "company": {
    "name": "CloudFlow CRM d.o.o.",
    "aliases": [
      "CloudFlow",
      "CloudFlow CRM",
      "Klaudflou CRM"
    ],
    "url": "https://cloudflow.rs",
    "vertical": "CRM softver za mala i srednja preduzeća",
    "offerings": [
      {
        "name": "CRM za prodajni tim",
        "source_url": "https://cloudflow.rs/proizvod",
        "evidence": "CRM za prodajni tim — pratite lead-ove, ponude i zatvorene poslove na jednom mestu."
      },
      {
        "name": "automatizacija marketinga",
        "source_url": "https://cloudflow.rs/marketing",
        "evidence": "Automatizacija marketinga — email kampanje i segmentacija kontakata bez ručnog rada."
      },
      {
        "name": "integracija sa računovodstvenim softverom",
        "source_url": "https://cloudflow.rs/integracije",
        "evidence": "Integracija sa računovodstvenim softverom — sinhronizujte fakture i uplate automatski."
      },
      {
        "name": "mobilna aplikacija za teren",
        "source_url": "https://cloudflow.rs/mobilna-app",
        "evidence": "Mobilna aplikacija za teren — unosite podatke sa terena i van kancelarije."
      },
      {
        "name": "cenovnik",
        "source_url": "https://cloudflow.rs/cenovnik",
        "evidence": "Cenovnik — planovi od 19 EUR po korisniku mesečno, besplatna proba 14 dana."
      }
    ],
    "locations": [
      {
        "city": "Beograd",
        "country": "RS",
        "source_url": "https://cloudflow.rs/kontakt"
      }
    ],
    "site_language": "sr",
    "confidence": "high"
  },
  "competitors": [
    {
      "name": "Pipedrive",
      "url": "https://pipedrive.com",
      "how_found": "websearch: najbolji CRM alati Srbija",
      "confidence": "medium"
    },
    {
      "name": "HubSpot",
      "url": "https://hubspot.com",
      "how_found": "websearch: CRM softver Srbija",
      "confidence": "medium"
    },
    {
      "name": "Bitrix24",
      "url": "https://bitrix24.com",
      "how_found": "websearch: CRM alternativa Bitrix24 Srbija",
      "confidence": "medium"
    },
    {
      "name": "Followup CRM",
      "url": "https://followupcrm.com",
      "how_found": "websearch: CloudFlow CRM alternativa",
      "confidence": "low"
    }
  ],
  "personas": [
    {
      "id": "p1",
      "label": "vlasnik male firme koji prvi put uvodi CRM",
      "derived_from": "site:/o-nama",
      "confidence": "medium"
    },
    {
      "id": "p2",
      "label": "sales menadžer u rastućem timu",
      "derived_from": "site:/proizvod",
      "confidence": "medium"
    },
    {
      "id": "p3",
      "label": "IT osoba zadužena za integracije",
      "derived_from": "site:/integracije",
      "confidence": "low"
    }
  ],
  "locale": {
    "primary": "sr-RS",
    "script_default": "latin",
    "paired_language": "en"
  },
  "distribution": {
    "target": {
      "problem_aware": [
        0.15,
        0.22
      ],
      "category_shortlist": [
        0.22,
        0.3
      ],
      "use_case": [
        0.15,
        0.22
      ],
      "comparison": [
        0.12,
        0.2
      ],
      "pricing": [
        0.08,
        0.12
      ],
      "local": [
        0.05,
        0.15
      ],
      "trust_risk": [
        0.05,
        0.1
      ],
      "branded": [
        0.08,
        0.15
      ]
    },
    "actual": {
      "problem_aware": 0.15,
      "category_shortlist": 0.25,
      "use_case": 0.2,
      "comparison": 0.125,
      "pricing": 0.075,
      "local": 0.075,
      "trust_risk": 0.05,
      "branded": 0.075
    },
    "n_intents": 40,
    "n_queries": 80
  },
  "matrix_plan": {
    "planned_total": 40,
    "cells": [
      {
        "category": "branded",
        "persona_id": "p1",
        "geo_city": null,
        "planned": 1
      },
      {
        "category": "branded",
        "persona_id": "p2",
        "geo_city": null,
        "planned": 1
      },
      {
        "category": "branded",
        "persona_id": "p3",
        "geo_city": null,
        "planned": 1
      },
      {
        "category": "category_shortlist",
        "persona_id": "p1",
        "geo_city": null,
        "planned": 4
      },
      {
        "category": "category_shortlist",
        "persona_id": "p2",
        "geo_city": null,
        "planned": 3
      },
      {
        "category": "category_shortlist",
        "persona_id": "p3",
        "geo_city": null,
        "planned": 3
      },
      {
        "category": "comparison",
        "persona_id": "p1",
        "geo_city": null,
        "planned": 2
      },
      {
        "category": "comparison",
        "persona_id": "p2",
        "geo_city": null,
        "planned": 2
      },
      {
        "category": "comparison",
        "persona_id": "p3",
        "geo_city": null,
        "planned": 1
      },
      {
        "category": "local",
        "persona_id": "p1",
        "geo_city": "Beograd",
        "planned": 1
      },
      {
        "category": "local",
        "persona_id": "p2",
        "geo_city": "Beograd",
        "planned": 1
      },
      {
        "category": "local",
        "persona_id": "p3",
        "geo_city": "Beograd",
        "planned": 1
      },
      {
        "category": "pricing",
        "persona_id": "p1",
        "geo_city": null,
        "planned": 1
      },
      {
        "category": "pricing",
        "persona_id": "p2",
        "geo_city": null,
        "planned": 1
      },
      {
        "category": "pricing",
        "persona_id": "p3",
        "geo_city": null,
        "planned": 1
      },
      {
        "category": "problem_aware",
        "persona_id": "p1",
        "geo_city": null,
        "planned": 2
      },
      {
        "category": "problem_aware",
        "persona_id": "p2",
        "geo_city": null,
        "planned": 2
      },
      {
        "category": "problem_aware",
        "persona_id": "p3",
        "geo_city": null,
        "planned": 2
      },
      {
        "category": "trust_risk",
        "persona_id": "p1",
        "geo_city": null,
        "planned": 1
      },
      {
        "category": "trust_risk",
        "persona_id": "p3",
        "geo_city": null,
        "planned": 1
      },
      {
        "category": "use_case",
        "persona_id": "p1",
        "geo_city": null,
        "planned": 2
      },
      {
        "category": "use_case",
        "persona_id": "p2",
        "geo_city": null,
        "planned": 3
      },
      {
        "category": "use_case",
        "persona_id": "p3",
        "geo_city": null,
        "planned": 3
      }
    ]
  },
  "intents": [
    {
      "intent_id": "int-001",
      "category": "problem_aware",
      "awareness_stage": "unaware",
      "intent_type": "informational",
      "micro_moment": "i_want_to_know",
      "buying_stage": "awareness",
      "persona_id": "p1",
      "priority": "tier1",
      "branded": false,
      "brand_mentioned": null,
      "competitors_mentioned": [],
      "geo": {
        "country": "RS",
        "city": null,
        "scope": "national"
      },
      "expected_answer_type": "explanation",
      "rationale": "Intent u kategoriji problem_aware, awareness_stage=unaware.",
      "grounding": {
        "type": null,
        "url": null,
        "quote": null
      },
      "inferred": true,
      "queries": [
        {
          "query_id": "int-001-sr",
          "lang": "sr",
          "text": "gubim previše vremena na ručno praćenje kontakata i ponuda",
          "script": "latin",
          "orthography": "diacritic",
          "word_count": 9,
          "variants": {
            "ascii": "gubim previse vremena na rucno pracenje kontakata i ponuda",
            "cyrillic": "губим превише времена на ручно праћење контаката и понуда"
          }
        },
        {
          "query_id": "int-001-en",
          "lang": "en",
          "text": "I keep losing track of leads and follow-ups in spreadsheets",
          "script": "latin",
          "orthography": "n/a",
          "word_count": 10,
          "variants": {}
        }
      ]
    },
    {
      "intent_id": "int-002",
      "category": "problem_aware",
      "awareness_stage": "problem_aware",
      "intent_type": "informational",
      "micro_moment": "i_want_to_do",
      "buying_stage": "awareness",
      "persona_id": "p1",
      "priority": "tier1",
      "branded": false,
      "brand_mentioned": null,
      "competitors_mentioned": [],
      "geo": {
        "country": "RS",
        "city": null,
        "scope": "national"
      },
      "expected_answer_type": "explanation",
      "rationale": "Intent u kategoriji problem_aware, awareness_stage=problem_aware.",
      "grounding": {
        "type": "site_page",
        "url": "https://cloudflow.rs/proizvod",
        "quote": "vidi source_url"
      },
      "inferred": false,
      "queries": [
        {
          "query_id": "int-002-sr",
          "lang": "sr",
          "text": "kako da prestanem da gubim lead-ove između prodavaca",
          "script": "latin",
          "orthography": "diacritic",
          "word_count": 8,
          "variants": {
            "ascii": "kako da prestanem da gubim lead-ove izmedju prodavaca",
            "cyrillic": "како да престанем да губим леад-ове између продаваца"
          }
        },
        {
          "query_id": "int-002-en",
          "lang": "en",
          "text": "how do I stop losing leads between sales reps",
          "script": "latin",
          "orthography": "n/a",
          "word_count": 9,
          "variants": {}
        }
      ]
    },
    {
      "intent_id": "int-003",
      "category": "problem_aware",